Filing Date,Document Type,Filed By,Description
"March 17, 2025","<a href=""https://docs.cpuc.ca.gov/SearchRes.aspx?DocFormat=ALL&DocID=559223118""><span style=""color:blue""><u>REPORT</u></span></a>","San Diego Gas & Electric Company,Pacific Gas and Electric Company,Southern California Edison Company",D.20-12-029 Annual StockTake Report.
"March 17, 2025","<a href=""https://docs.cpuc.ca.gov/SearchRes.aspx?DocFormat=ALL&DocID=559371492""><span style=""color:blue""><u>REPORT</u></span></a>",Southern California Edison Company,"Annual Report on Vehicle-Grid Integration Strategies, Programs, & Pilots Metrics."
"December 19, 2024","<a href=""https://docs.cpuc.ca.gov/SearchRes.aspx?DocFormat=ALL&DocID=550330497""><span style=""color:blue""><u>DECISION</u></span></a>",,Decision D2412065 - Decision Granting Intervenor Compensation To National Diversity Coalition For Substantial Contribution To Decision 22-11-040.
"December 13, 2024","<a href=""https://docs.cpuc.ca.gov/SearchRes.aspx?DocFormat=ALL&DocID=549795600""><span style=""color:blue""><u>COMPLIANCE  FILING</u></span></a>","Pacific Gas and Electric Company,Southern California Edison Company,San Diego Gas & Electric Company","Amended Joint Compliance Filing of Southern California Edison Company, San Diego Gas & Electric Company and Pacific Gas and Electric Company pursuant to Ordering Paragraph 2 of Decision 16-06-011."
"November 14, 2024","<a href=""https://docs.cpuc.ca.gov/SearchRes.aspx?DocFormat=ALL&DocID=546381900""><span style=""color:blue""><u>PROPOSED DECISION</u></span></a>",CMMR/ALICE REYNOLDS/CPUC,"PROPOSED DECISION GRANTING INTERVENOR COMPENSATION TO NATIONAL DIVERSITY COALITION FOR SUBSTANTIAL CONTRIBUTION TO DECISION 22-11-040. Opening Comments, which shall not exceed 15 pages, are due on December 4, 2024. Reply Comments, which shall not exceed 5 pages, are due 5 days after the last for filing Opening Comments."
"September 16, 2024","<a href=""https://docs.cpuc.ca.gov/SearchRes.aspx?DocFormat=ALL&DocID=540719872""><span style=""color:blue""><u>REPORT</u></span></a>",Southern California Edison Company,"Mid-Term Report on Vehicle-Grid Integration Strategies, Programs and Pilot Metrics."
"August 02, 2024","<a href=""https://docs.cpuc.ca.gov/SearchRes.aspx?DocFormat=ALL&DocID=542866982""><span style=""color:blue""><u>REQUEST</u></span></a>",The Utility Reform Network,for intervenor compensation for contribution to D24-05-043 and OIR 23-12-008
"June 12, 2024","<a href=""https://docs.cpuc.ca.gov/SearchRes.aspx?DocFormat=ALL&DocID=533837256""><span style=""color:blue""><u>AMENDMENT</u></span></a>","LIBERTY UTILITIES (CALPECO ELECTRIC) LLC,PACIFICORP,BEAR VALLEY ELECTRIC SERVICE, INC.",Amended Joint Compliance Filing pursuant to OP9 of Resolution E-5168.
"May 30, 2024","<a href=""https://docs.cpuc.ca.gov/SearchRes.aspx?DocFormat=ALL&DocID=533067050""><span style=""color:blue""><u>DECISION</u></span></a>",,"Decision D2405043 - Decision Denying California Large Energy Consumer Association, Energy Producers And Users Coalition Petition For Modification Of Decision 22-11-040. This proceeding is closed."
"May 16, 2024","<a href=""https://docs.cpuc.ca.gov/SearchRes.aspx?DocFormat=ALL&DocID=531772126""><span style=""color:blue""><u>COMMENTS</u></span></a>","Energy Producers and Users Coalition,California Large Energy Consumers Association",California Large Energy Consumers Association and Energy Producers and Users Coalition opening comments on Proposed Decision denying Petition for Modification of Decision 22-11-040.
"May 10, 2024","<a href=""https://docs.cpuc.ca.gov/SearchRes.aspx?DocFormat=ALL&DocID=531378763""><span style=""color:blue""><u>DECISION</u></span></a>",,Decision D2405030 - Order Correcting Error.
"May 09, 2024","<a href=""https://docs.cpuc.ca.gov/SearchRes.aspx?DocFormat=ALL&DocID=531245588""><span style=""color:blue""><u>REQUEST</u></span></a>",Green Power Institute,"Supplement; to Request for Intervenor Compensation [filed on January 13, 2023]"
"April 30, 2024","<a href=""https://docs.cpuc.ca.gov/SearchRes.aspx?DocFormat=ALL&DocID=531248917""><span style=""color:blue""><u>AMENDMENT</u></span></a>",Pacific Gas and Electric Company,"(AMENDED ) CORRECTED LANGUAGE FOR THE JOINT COMPLIANCE FILINGOF SOUTHERN CALIFORNIA EDISON COMPANY (U 338-E), SAN DIEGO GAS & ELECTRIC COMPANY (U 902 E) AND PACIFIC GASAND ELECTRIC COMPANY (U 93 E) PURSUANT TO ORDERING PARAGRAPH 2 OF DECISION 16-06-01, [ filed on April 2, 2024 (Document 240410300)]"
"April 26, 2024","<a href=""https://docs.cpuc.ca.gov/SearchRes.aspx?DocFormat=ALL&DocID=530304834""><span style=""color:blue""><u>PROPOSED DECISION</u></span></a>",CMMR/ALICE REYNOLDS/CPUC,"Proposed Decision denying California Large Energy Consumer Association, Energy Producers and Users Coalition Petition for Modification of Decision 22-11-040. Opening comments, which shall not exceed 15 pages, are due no later than May 16, 2024. Reply comments, which shall not exceed 5 pages, are due within five days after the last day for filing opening comments."
"April 02, 2024","<a href=""https://docs.cpuc.ca.gov/SearchRes.aspx?DocFormat=ALL&DocID=529238362""><span style=""color:blue""><u>COMPLIANCE  FILING</u></span></a>","Bear Valley Electric Service,Liberty Utilities,PacifiCorp",Joint Compliance Filing pursuant to O.P. 9 of Resolution E-5168.
"April 02, 2024","<a href=""https://docs.cpuc.ca.gov/SearchRes.aspx?DocFormat=ALL&DocID=528996522""><span style=""color:blue""><u>LAW & MOTION</u></span></a>",Pacific Gas and Electric Company,"(PUBLIC VERSION) Confidential Version of the Attachment to Joint Compliance Filing of SoCal Edison Co., San Diego Gas & Electric Company & PG&E Company pursuant to Ordering paragraph 2 of Decision 16-06-011."
"April 02, 2024","<a href=""https://docs.cpuc.ca.gov/SearchRes.aspx?DocFormat=ALL&DocID=529073552""><span style=""color:blue""><u>COMPLIANCE  FILING</u></span></a>","PACIFIC GAS AND ELECTRIC COMPANY,SAN DIEGO GAS & ELECTRIC COMPANY,SOUTHERN CALIFORNIA EDISON COMPANY",Joint Compliance Filing pursuant to O.P. 2 of Decision 16-06-011.
"April 02, 2024","<a href=""https://docs.cpuc.ca.gov/SearchRes.aspx?DocFormat=ALL&DocID=528920178""><span style=""color:blue""><u>REPORT</u></span></a>",Pacific Gas and Electric Company,"(PUBLIC VERSION) Confidential Version of the Attachment to Joint Compliance Filing of SoCal Edison Co., San Diego Gas & Electric Company & PG&E Company pursuant to Ordering paragraph 2 of Decision 16-06-011."
"March 15, 2024","<a href=""https://docs.cpuc.ca.gov/SearchRes.aspx?DocFormat=ALL&DocID=527532413""><span style=""color:blue""><u>COMPLIANCE  FILING</u></span></a>",Southern California Edison Company,"Annual Report on Vehicle-Grid Integration Strategies, Programs and Pilot Metrics."
"March 15, 2024","<a href=""https://docs.cpuc.ca.gov/SearchRes.aspx?DocFormat=ALL&DocID=527532698""><span style=""color:blue""><u>LAW & MOTION</u></span></a>",Pacific Gas and Electric Company,[PUBLIC VERSION] Annual Vehicle-Grid Integration Strategies Report for 2023.
"March 15, 2024","<a href=""https://docs.cpuc.ca.gov/SearchRes.aspx?DocFormat=ALL&DocID=527532386""><span style=""color:blue""><u>LAW & MOTION</u></span></a>",San Diego Gas & Electric Company,(PUBLIC VERSION) Vehicle Grid Integration Activities Annual Report for 2023.
"March 15, 2024","<a href=""https://docs.cpuc.ca.gov/SearchRes.aspx?DocFormat=ALL&DocID=527440708""><span style=""color:blue""><u>COMPLIANCE  FILING</u></span></a>","Pacific Gas and Electric Company,Southern California Edison Company,San Diego Gas & Electric Company",D.20-12-019 ANNUAL STOCKTAKE REPORT.
"March 15, 2024","<a href=""https://docs.cpuc.ca.gov/SearchRes.aspx?DocFormat=ALL&DocID=527737436""><span style=""color:blue""><u>REPORT</u></span></a>",Pacific Gas and Electric Company,[PUBLIC VERSION] Annual Vehicle-Grid Integration Strategies Report for 2023.
"March 15, 2024","<a href=""https://docs.cpuc.ca.gov/SearchRes.aspx?DocFormat=ALL&DocID=527230490""><span style=""color:blue""><u>COMPLIANCE  FILING</u></span></a>",Valley Clean Energy Alliance,ANNUAL VEHICLE GRID INTEGRATION REPORT
"March 15, 2024","<a href=""https://docs.cpuc.ca.gov/SearchRes.aspx?DocFormat=ALL&DocID=527737400""><span style=""color:blue""><u>COMPLIANCE  FILING</u></span></a>",San Diego Gas & Electric Company,(PUBLIC VERSION) Vehicle Grid Integration Activities Annual Report for 2023.
"February 15, 2024","<a href=""https://docs.cpuc.ca.gov/SearchRes.aspx?DocFormat=ALL&DocID=526011373""><span style=""color:blue""><u>DECISION</u></span></a>",,Decision D2402029 - Decision Granting Compensation To The Utility Consumers' Action Network For Substantial Contribution To Decision 22-08-024 And Decision 21-12-033.
"February 15, 2024","<a href=""https://docs.cpuc.ca.gov/SearchRes.aspx?DocFormat=ALL&DocID=525523534""><span style=""color:blue""><u>DECISION</u></span></a>",,Decision D2402028 - Decision Granting Compensation To Natural Resources Defense Council For Substantial Contribution To Decision 22-11-040.
"February 05, 2024","<a href=""https://docs.cpuc.ca.gov/SearchRes.aspx?DocFormat=ALL&DocID=524929464""><span style=""color:blue""><u>REPLY</u></span></a>",San Diego Gas & Electric Company,Reply Comments on OIR Regarding Transportation Electrification Policy and Infrastructure.
"January 29, 2024","<a href=""https://docs.cpuc.ca.gov/SearchRes.aspx?DocFormat=ALL&DocID=524604057""><span style=""color:blue""><u>COMMENTS</u></span></a>",Small Business Utility Advocates,REPLY COMMENTS ON PROPOSED DECISION
"January 25, 2024","<a href=""https://docs.cpuc.ca.gov/SearchRes.aspx?DocFormat=ALL&DocID=524509975""><span style=""color:blue""><u>DECISION</u></span></a>",,"Decision D2401057 - Decision Granting Compensation Claim To East Yard Communities For Environmental Justice For Contributions To Decisions (D.) 22-11-040, D.21-07-028, And D.20-12-027."
"January 24, 2024","<a href=""https://docs.cpuc.ca.gov/SearchRes.aspx?DocFormat=ALL&DocID=524905054""><span style=""color:blue""><u>COMMENTS</u></span></a>",The Utility Reform Network,Comments of The Utility Reform Network on the Proposed Decision of Commissioner Alice Reyolds granting compensation to Natural Resources Defense Council for substantial contribution to Decision 22-11-040.
"January 24, 2024","<a href=""https://docs.cpuc.ca.gov/SearchRes.aspx?DocFormat=ALL&DocID=524904614""><span style=""color:blue""><u>COMMENTS</u></span></a>",Natural Resources Defense Council,Natural Resources Defense Council comments on the Proposed Decision granting compensation to the Natural Resources Defense Council for substantial contribution to Decision 22-11-040.
"January 19, 2024","<a href=""https://docs.cpuc.ca.gov/SearchRes.aspx?DocFormat=ALL&DocID=524571004""><span style=""color:blue""><u>COMMENTS</u></span></a>",Southern California Edison Company,OPENING COMMENTS OF SOUTHERN CALIFORNIA EDISON COMPANY (U 338-E) ON THE ORDER INSTITUTING RULEMAKING REGARDING TRANSPORTATION ELECTRIFICATION POLICY AND INFRASTRUCTURE AND CLOSING RULEMAKING 18-12-006
"January 19, 2024","<a href=""https://docs.cpuc.ca.gov/SearchRes.aspx?DocFormat=ALL&DocID=526147937""><span style=""color:blue""><u>COMMENTS</u></span></a>",Green Power Institute,Comments on Preliminary Scoping Memo.
"January 19, 2024","<a href=""https://docs.cpuc.ca.gov/SearchRes.aspx?DocFormat=ALL&DocID=524570695""><span style=""color:blue""><u>COMMENTS</u></span></a>",San Diego Gas & Electric Company,OPENING COMMENTS OF SAN DIEGO GAS & ELECTRIC COMPANY (U 902-E) ON ORDER INSTITUTING RULEMAKING REGARDING TRANSPORTATION ELECTRIFICATION POLICY AND INFRASTRUCTURE
"January 19, 2024","<a href=""https://docs.cpuc.ca.gov/SearchRes.aspx?DocFormat=ALL&DocID=523984320""><span style=""color:blue""><u>COMMENTS</u></span></a>",Vehicle-Grid Integration Council,COMMENTS OF THE VEHICLE-GRID INTEGRATION COUNCIL ON ORDER INSTITUTING RULEMAKING REGARDING TRANSPORTATION  ELECTRIFICATION POLICY AND INFRASTRUCTURE AND CLOSING RULEMAKING 18-12-006
"January 17, 2024","<a href=""https://docs.cpuc.ca.gov/SearchRes.aspx?DocFormat=ALL&DocID=523791735""><span style=""color:blue""><u>NOTICE</u></span></a>",Ava Community Energy Authority,NOTICE OF PARTY NAME CHANGE FROM EAST BAY COMMUNITY ENERGY AUTHORITY TO AVA COMMUNITY ENERGY AUTHORITY
"January 11, 2024","<a href=""https://docs.cpuc.ca.gov/SearchRes.aspx?DocFormat=ALL&DocID=523690984""><span style=""color:blue""><u>DECISION</u></span></a>",,"Decision D2401014 - Decision Granting Compensation To The Utility Reform Network For Substantial Contribution To Decision (D.) 20-12-024, D.20-12-029, D.21-07-028. D.21-12-030, D.21-12-033, D.22-08-024, D.22-11-040, Resolution E-5167 and Resolution E-5227."
"January 04, 2024","<a href=""https://docs.cpuc.ca.gov/SearchRes.aspx?DocFormat=ALL&DocID=522745878""><span style=""color:blue""><u>PROPOSED DECISION</u></span></a>",CMMR/ALICE REYNOLDS/CPUC,"PROPOSED DECISION GRANTING COMPENSATION TO NATURAL RESOURCES DEFENSE COUNCIL FOR SUBSTANTIAL CONTRIBUTION TO DECISION 22-11-040. Opening Comments, which shall not exceed 15 pages, are due on January 24, 2024. Reply Comments, which shall not exceed 5 pages, are due 5 days after the last day for filing Opening Comments."
"January 02, 2024","<a href=""https://docs.cpuc.ca.gov/SearchRes.aspx?DocFormat=ALL&DocID=522696298""><span style=""color:blue""><u>COMMENTS</u></span></a>","California Large Energy Consumers Association,Energy Producers and Users Coalition",JOINT REPLY TO COMMENTS ON THE JOINT PETITION FOR MODIFICATION OF D.22-11-040
"December 26, 2023","<a href=""https://docs.cpuc.ca.gov/SearchRes.aspx?DocFormat=ALL&DocID=521999737""><span style=""color:blue""><u>RULING</u></span></a>",ALJ/RIZZO/CPUC,EMAIL RULING GRANTING ENERGY PRODUCERS AND USERS COALITIONAND CALIFORNIA LARGE ENERGY CONSUMERS ASSOCIATION REQUEST TO FILE A REPLY TO RESPONSE TO ITS PETITION FOR MODIFICATION
"December 18, 2023","<a href=""https://docs.cpuc.ca.gov/SearchRes.aspx?DocFormat=ALL&DocID=522696301""><span style=""color:blue""><u>RESPONSE</u></span></a>",Pacific Gas and Electric Company,"RESPONSE TO CALIFORNIA LARGE ENERGY CONSUMER ASSOCIATION, ENERGY PRODUCERS AND USERS COALITION JOINT PETITION FOR MODIFICATION OF D.22-11-040"
"December 18, 2023","<a href=""https://docs.cpuc.ca.gov/SearchRes.aspx?DocFormat=ALL&DocID=522262106""><span style=""color:blue""><u>RESPONSE</u></span></a>","Sierra Club,EAST YARD COMMUNITIES FOR ENVIRONMENTAL JUSTICE,Center for Community Action and Environmental Justice,Union of Concerned Scientists","JOINT RESPONSE OF CENTER FOR COMMUNITY ACTION AND ENVIRONMENTAL JUSTICE, EAST YARD COMMUNITIES FOR ENVIRONMENTAL JUSTICE, SIERRA CLUB, AND UNION OF CONCERNED SCIENTISTS TO PETITION FOR MODIFICATION"
"December 18, 2023","<a href=""https://docs.cpuc.ca.gov/SearchRes.aspx?DocFormat=ALL&DocID=521581836""><span style=""color:blue""><u>RESPONSE</u></span></a>",The Utility Reform Network,"RESPONSE TO CALIFORNIA LARGE ENERGY CONSUMERS ASSOCIATION, ENERGY PRODUCERS AND USERS COALITION JOINT PETITION FOR MODIFICATION OF D.22-11-040"
"December 18, 2023","<a href=""https://docs.cpuc.ca.gov/SearchRes.aspx?DocFormat=ALL&DocID=521589394""><span style=""color:blue""><u>RESPONSE</u></span></a>",Cal Advocates/EINHORN/CPUC,RESPONSE TO PETITION FOR MODIFICATION OF DECISION 22-11-040 OF CALIFORNIA LARGE ENERGY CONSUMERS ASSOCIATION AND ENERGY PRODUCERS AND USERS COALITION
"December 18, 2023","<a href=""https://docs.cpuc.ca.gov/SearchRes.aspx?DocFormat=ALL&DocID=521745649""><span style=""color:blue""><u>RESPONSE</u></span></a>",SAN DIEGO GAS & ELECTRIC COMPANY,"SAN DIEGO GAS & ELECTRIC COMPANYS (U 902 M) RESPONSE TO CALIFORNIA LARGE ENERGY CONSUMER ASSOCIATION, ENERGY PRODUCERS AND USERS COALITION JOINT PETITION FOR MODIFICATION OF D.22-11-010"
"December 15, 2023","<a href=""https://docs.cpuc.ca.gov/SearchRes.aspx?DocFormat=ALL&DocID=522262044""><span style=""color:blue""><u>REQUEST</u></span></a>",The Utility Reform Network,"AMENMENT; to Request for intervenor compensation for contribution to D20-12-027, D20-12-029, D21-07-028, D21-12-030, D21-12-033, D22-08-024, D22-11-040, Resolution E-5167, Resolution E-5227"
"December 14, 2023","<a href=""https://docs.cpuc.ca.gov/SearchRes.aspx?DocFormat=ALL&DocID=521872957""><span style=""color:blue""><u>FINAL DECISION</u></span></a>",CPUC,"ORDER INSTITUTING RULEMAKING CLOSING RULEMAKING 18-12-006
"
"December 14, 2023","<a href=""https://docs.cpuc.ca.gov/SearchRes.aspx?DocFormat=ALL&DocID=521833477""><span style=""color:blue""><u>DECISION</u></span></a>",,Decision D2312032 - Decision Granting Compensation To Small Business Utility Advocates For Substantial Contribution To Decision 21-12-033.
"December 14, 2023","<a href=""https://docs.cpuc.ca.gov/SearchRes.aspx?DocFormat=ALL&DocID=521532455""><span style=""color:blue""><u>DECISION</u></span></a>",,Decision D2312031 - Decision Granting Compensation To Small Business Utility Advocates For Substantial Contribution To Decision 22-11-040.
"December 13, 2023","<a href=""https://docs.cpuc.ca.gov/SearchRes.aspx?DocFormat=ALL&DocID=521479812""><span style=""color:blue""><u>RULING</u></span></a>",ALJ/POIRIER/CPUC,EMAIL RULING SUSPENDING SCHEDULE OF TIER 2 ADVICE LETTER ORDERED IN RESOLUTION E-5247.  The Commission will provide further instructions as well as a new due date for the Joint Tier 2 Advice Letter in January 2024.
"November 30, 2023","<a href=""https://docs.cpuc.ca.gov/SearchRes.aspx?DocFormat=ALL&DocID=521288818""><span style=""color:blue""><u>DECISION</u></span></a>",,Decision D2311110 - Decision Granting Intervenor Compensation To Utility Consumers' Action Network For Contributions To Decision 22-11-040.
"November 17, 2023","<a href=""https://docs.cpuc.ca.gov/SearchRes.aspx?DocFormat=ALL&DocID=520913368""><span style=""color:blue""><u>PETITION FOR MODIFICATION</u></span></a>","Energy Producers and Users Coalition,California Large Energy Consumers Association",JOINT PETITION FOR MODIFICATION OF DECISION 22-11-040
"November 13, 2023","<a href=""https://docs.cpuc.ca.gov/SearchRes.aspx?DocFormat=ALL&DocID=520772856""><span style=""color:blue""><u>RULING</u></span></a>",ALJ/POIRIER/CPUC,EMAIL RULING DELAYING THE TIMING OF THE VEHICLE-GRID INTEGRATION (VGI) FORUMS ORDERED IN D.22-11-040
"November 02, 2023","<a href=""https://docs.cpuc.ca.gov/SearchRes.aspx?DocFormat=ALL&DocID=520717229""><span style=""color:blue""><u>DECISION</u></span></a>",,Decision D2311009 - Decision Modifying Decision 22-11-040. Rulemaking 18-12-006 remains open.
"October 30, 2023","<a href=""https://docs.cpuc.ca.gov/SearchRes.aspx?DocFormat=ALL&DocID=520650614""><span style=""color:blue""><u>REPORT</u></span></a>","Bear Valley Electric Service, Inc.,Pacificorp,Pacific Gas and Electric Company,Southern California Edison Company,San Diego Gas & Electric Company,Liberty Utilities (Calpeco Electric) LLC",Compliance filing pursuant to Ordering Paragraph 6 in Resolution E-5247 and E- mail Ruling Setting Workshop on Electric Vehicle Charging Infrastructure Service Energization Process.
"October 24, 2023","<a href=""https://docs.cpuc.ca.gov/SearchRes.aspx?DocFormat=ALL&DocID=520613963""><span style=""color:blue""><u>RULING</u></span></a>",ALJ/POIRIER/CPUC,ADMINISTRATIVE LAW JUDGES RULING REGARDING MOTION FOR CLARIFICATION
"October 02, 2023","<a href=""https://docs.cpuc.ca.gov/SearchRes.aspx?DocFormat=ALL&DocID=520522169""><span style=""color:blue""><u>NOTICE</u></span></a>",San Diego Community Power,NOTICE OF SUBSTITUTION OF COUNSEL
"September 25, 2023","<a href=""https://docs.cpuc.ca.gov/SearchRes.aspx?DocFormat=ALL&DocID=520482362""><span style=""color:blue""><u>COMPLIANCE  FILING</u></span></a>","San Diego Gas & Electric Company,Pacific Gas and Electric Company,Southern California Edison Company",JOINT WORKSHOP REPORT ON PLUG-IN ELECTRIC VEHICLE SUBMETERING  
"September 15, 2023","<a href=""https://docs.cpuc.ca.gov/SearchRes.aspx?DocFormat=ALL&DocID=520418912""><span style=""color:blue""><u>LAW & MOTION</u></span></a>",San Diego Gas & Electric Company,MOTION FOR LEAVE TO FILE CONFIDENTIAL COMPLIANCE FILING UNDER SEAL
"September 15, 2023","<a href=""https://docs.cpuc.ca.gov/SearchRes.aspx?DocFormat=ALL&DocID=520433771""><span style=""color:blue""><u>COMPLIANCE  FILING</u></span></a>",Pacific Gas and Electric Company,(PUBLIC VERSION) Vehicle-Grid Integration Strategies Semi-Annual Report for September 2023.
"September 15, 2023","<a href=""https://docs.cpuc.ca.gov/SearchRes.aspx?DocFormat=ALL&DocID=520418911""><span style=""color:blue""><u>COMPLIANCE  FILING</u></span></a>",San Diego Gas & Electric Company,[PUBLIC VERSION] VEHICLE GRID INTEGRATION ACTIVITIES MID-TERM REPORT FOR 2023
"September 15, 2023","<a href=""https://docs.cpuc.ca.gov/SearchRes.aspx?DocFormat=ALL&DocID=520107311""><span style=""color:blue""><u>LAW & MOTION</u></span></a>",Pacific Gas and Electric Company,(PUBLIC VERSION) Vehicle-Grid Integration Strategies Semi-Annual Report for September 2023.
"September 15, 2023","<a href=""https://docs.cpuc.ca.gov/SearchRes.aspx?DocFormat=ALL&DocID=520433748""><span style=""color:blue""><u>COMPLIANCE  FILING</u></span></a>",Southern California Edison Company,"MID-TERM REPORT ON VEHICLE-GRID INTEGRATION STRATEGIES, PROGRAMS AND PILOTS METRICS"
"September 14, 2023","<a href=""https://docs.cpuc.ca.gov/SearchRes.aspx?DocFormat=ALL&DocID=520469503""><span style=""color:blue""><u>RULING</u></span></a>",ALJ/POIRIER/CPUC,"EMAIL RULING SETTING WORKSHOP ON ELECTRIC VEHICLE CHARGING INFRASTRUCTURE SERVICE ENERGIZATION PROCESS. This e-mail ruling provide notice that Energy Division staff will host a public workshop on Friday, September 29, 2023. We also direct the investor-owned utilities (IOUs) to file a workshop report service list within 30 days of the workshop."
"June 28, 2023","<a href=""https://docs.cpuc.ca.gov/SearchRes.aspx?DocFormat=ALL&DocID=512707481""><span style=""color:blue""><u>REQUEST</u></span></a>",Natural Resources Defense Council,for intervenor compensation for contribution to D22-11-040
"June 26, 2023","<a href=""https://docs.cpuc.ca.gov/SearchRes.aspx?DocFormat=ALL&DocID=512538925""><span style=""color:blue""><u>RESPONSE</u></span></a>","Pacific Gas and Electric Company,San Diego Gas & Electric Company",Response on Petition for Modification of Decision 22-11-040 of Southern California Edison Company.
"June 22, 2023","<a href=""https://docs.cpuc.ca.gov/SearchRes.aspx?DocFormat=ALL&DocID=512123337""><span style=""color:blue""><u>RESPONSE</u></span></a>",Cal Advocates/Gibbs/CPUC,Response to Southern California Eison Company Motion for Clarification of Decision 222-08-024 and Decision 22-11-040.
"June 22, 2023","<a href=""https://docs.cpuc.ca.gov/SearchRes.aspx?DocFormat=ALL&DocID=512142587""><span style=""color:blue""><u>RESPONSE</u></span></a>",San Diego Gas & Electric Company,RESPONSE TO MOTION FOR CLARIFICATION OF DECISION 22-08-024 AND DECISION 22-11-040
"June 08, 2023","<a href=""https://docs.cpuc.ca.gov/SearchRes.aspx?DocFormat=ALL&DocID=511552326""><span style=""color:blue""><u>DECISION</u></span></a>",,"Decision D2306018 - Decision Granting Compensation To Green Power Institute For Substantial Contribution To Decision (D). 20-09-025, D.20-12-027, D.20-12-029, And D.21-07-028."
"June 07, 2023","<a href=""https://docs.cpuc.ca.gov/SearchRes.aspx?DocFormat=ALL&DocID=510851125""><span style=""color:blue""><u>MOTION</u></span></a>",Southern California Edison Company,MOTION FOR CLARIFICATION OF DECISION 22-08-024 AND DECISION 22-11-040 
"May 26, 2023","<a href=""https://docs.cpuc.ca.gov/SearchRes.aspx?DocFormat=ALL&DocID=509788937""><span style=""color:blue""><u>RULING</u></span></a>",ALJ/RIZZO/CPUC,EMAIL RULING GRANTING THE MOTION FOR PARTY STATUS OF GRIDTRACTOR INC
"May 25, 2023","<a href=""https://docs.cpuc.ca.gov/SearchRes.aspx?DocFormat=ALL&DocID=509774455""><span style=""color:blue""><u>PETITION FOR MODIFICATION</u></span></a>",Southern California Edison Company,Petition for Modification of Decision (D.) 22-11-040.
"May 25, 2023","<a href=""https://docs.cpuc.ca.gov/SearchRes.aspx?DocFormat=ALL&DocID=509544260""><span style=""color:blue""><u>MOTION</u></span></a>",Gridtractor Inc.,"MOTION FOR PARTY STATUS OF GRIDTRACTOR INC. MFPS GRANTED via E-mail Ruling Issued by ALJ Colin Rizzo on May 26, 2023."
"May 12, 2023","<a href=""https://docs.cpuc.ca.gov/SearchRes.aspx?DocFormat=ALL&DocID=508571473""><span style=""color:blue""><u>REQUEST</u></span></a>",Green Power Institute,AMENDED; for intervenor compensation for contribution to D22-11-040
"May 01, 2023","<a href=""https://docs.cpuc.ca.gov/SearchRes.aspx?DocFormat=ALL&DocID=507816318""><span style=""color:blue""><u>COMPLIANCE  FILING</u></span></a>","LIBERTY UTILITIES (CALPECO ELECTRIC) LLC,PACIFICORP,BEAR VALLEY ELECTTRIC SERVICE, INC.",Joint Compliance Filing pursuant to Ordering Paragraph 9 of Resolution E-5168.
"April 03, 2023","<a href=""https://docs.cpuc.ca.gov/SearchRes.aspx?DocFormat=ALL&DocID=506170075""><span style=""color:blue""><u>COMPLIANCE  FILING</u></span></a>","San Diego Gas & Electric Company,Southern California Edison Company,Pacific Gas and Electric Company",JOINT COMPLIANCE FILING PURSUANT TO ORDERING PARAGRAPH 2 OF DECISION 16-06-011
"March 17, 2023","<a href=""https://docs.cpuc.ca.gov/SearchRes.aspx?DocFormat=ALL&DocID=503824101""><span style=""color:blue""><u>COMPLIANCE  FILING</u></span></a>","San Diego Gas & Electric Company,Pacific Gas and Electric Company,Southern California Edison Company","Updated D. 20-12-019 Annual Stocktake Report by Pacific Gas and Electric Company, San Diego Gas & Electric Company, and Southern California Edison Company (original report previously filed on 3/15/2023)."
"March 16, 2023","<a href=""https://docs.cpuc.ca.gov/SearchRes.aspx?DocFormat=ALL&DocID=504201197""><span style=""color:blue""><u>DECISION</u></span></a>",,Decision D2303043 - Decision Granting Compensation To Utility Consumers' Action Network For Substantial Contribution To Decision (D.) 20-12-029 And D.21-07-028.
